{
  "schema_version": "1.0",
  "spec_version": "0.2",
  "status": "draft",
  "project": {
    "project_id": "mspe_49600_fa26_pr01",
    "course": "MSPE 49600: Data Analytics for Motorsports",
    "term": "Fall 2026",
    "title": "Motorsports Data Preparation and Introduction to Modeling",
    "total_points": 100,
    "description": "Project 1 focuses on data preparation, grouped analysis, feature selection, second-order polynomial regression, visualization, and engineering interpretation using IMS Sector 3 setup-test data."
  },
  "sources": [
    {
      "source_id": "project_project_01_intro_to_modeling_pdf",
      "source_type": "project_instructions",
      "path": "project/Project_01_Intro_to_Modeling.pdf",
      "description": "Original published assignment; primary authority for student requirements.",
      "required_for_grading": true
    },
    {
      "source_id": "project_project_instructions_md",
      "source_type": "project_instructions",
      "path": "project/project_instructions.md",
      "description": "Draft instruction transcription used to clarify assignment structure; does not add requirements beyond the PDF.",
      "required_for_grading": false
    },
    {
      "source_id": "rubric_instructor_rubric_md",
      "source_type": "rubric",
      "path": "rubric/instructor_rubric_v002.md",
      "description": "Corrected draft rubric. Published maxima are explicit; deduction amounts are proposed for instructor approval.",
      "required_for_grading": false
    },
    {
      "source_id": "reference_reference_solution_md",
      "source_type": "reference_solution",
      "path": "reference/reference_solution.md",
      "description": "Reference solution illustrating one valid approach; not the only acceptable solution.",
      "required_for_grading": false
    },
    {
      "source_id": "datasets_ims_setup_raw_csv",
      "source_type": "dataset",
      "path": "datasets/ims_setup_raw.csv",
      "description": "Raw dataset for the project.",
      "required_for_grading": false
    }
  ],
  "deliverables": [
    {
      "deliverable_id": "notebook_ipynb",
      "description": "Completed Jupyter notebook submission.",
      "required": true,
      "file_patterns": [
        "username_pr01_notebook.ipynb"
      ],
      "file_types": [
        "ipynb"
      ],
      "applies_to_tasks": [
        "task1",
        "task2",
        "task3",
        "task4",
        "task5",
        "task6"
      ],
      "missing_rule": "follow_criterion_rules",
      "notes": "Original filename compliance is checked locally before anonymization. A missing/misnamed standalone file is scored once in task6."
    },
    {
      "deliverable_id": "notebook_pdf",
      "description": "Notebook exported as PDF.",
      "required": true,
      "file_patterns": [
        "username_pr01_notebook.pdf"
      ],
      "file_types": [
        "pdf"
      ],
      "applies_to_tasks": [
        "task1",
        "task2",
        "task3",
        "task4",
        "task5",
        "task6"
      ],
      "missing_rule": "follow_criterion_rules",
      "notes": "Original filename compliance is checked locally before anonymization. A missing/misnamed standalone file is scored once in task6."
    },
    {
      "deliverable_id": "notebook_py",
      "description": "Notebook exported as a Python script containing the same code as the submitted notebook.",
      "required": true,
      "file_patterns": [
        "username_pr01_notebook.py"
      ],
      "file_types": [
        "py"
      ],
      "applies_to_tasks": [
        "task1",
        "task2",
        "task3",
        "task4",
        "task5",
        "task6"
      ],
      "missing_rule": "follow_criterion_rules",
      "notes": "Original filename compliance is checked locally before anonymization. A missing/misnamed standalone file is scored once in task6."
    },
    {
      "deliverable_id": "analysis_csv",
      "description": "Final analysis dataset saved from Task I.",
      "required": true,
      "file_patterns": [
        "username_pr01_analysis.csv"
      ],
      "file_types": [
        "csv"
      ],
      "applies_to_tasks": [
        "task1",
        "task6"
      ],
      "missing_rule": "follow_criterion_rules",
      "notes": "Original filename compliance is checked locally before anonymization. A missing/misnamed standalone file is scored once in task6."
    },
    {
      "deliverable_id": "grouped_csv",
      "description": "Grouped configuration summary saved from Task II.",
      "required": true,
      "file_patterns": [
        "username_pr01_grouped.csv"
      ],
      "file_types": [
        "csv"
      ],
      "applies_to_tasks": [
        "task2",
        "task6"
      ],
      "missing_rule": "follow_criterion_rules",
      "notes": "Original filename compliance is checked locally before anonymization. A missing/misnamed standalone file is scored once in task6."
    },
    {
      "deliverable_id": "model_csv",
      "description": "Model DataFrame saved from Task IV.",
      "required": true,
      "file_patterns": [
        "username_pr01_model.csv"
      ],
      "file_types": [
        "csv"
      ],
      "applies_to_tasks": [
        "task4",
        "task6"
      ],
      "missing_rule": "follow_criterion_rules",
      "notes": "Original filename compliance is checked locally before anonymization. A missing/misnamed standalone file is scored once in task6."
    },
    {
      "deliverable_id": "correlation_png",
      "description": "Correlation heatmap figure.",
      "required": true,
      "file_patterns": [
        "username_pr01_correlation.png"
      ],
      "file_types": [
        "png"
      ],
      "applies_to_tasks": [
        "task3",
        "task6"
      ],
      "missing_rule": "follow_criterion_rules",
      "notes": "Original filename compliance is checked locally before anonymization. A missing/misnamed standalone file is scored once in task6."
    },
    {
      "deliverable_id": "pairplot_png",
      "description": "Pairplot figure.",
      "required": true,
      "file_patterns": [
        "username_pr01_pairplot.png"
      ],
      "file_types": [
        "png"
      ],
      "applies_to_tasks": [
        "task3",
        "task6"
      ],
      "missing_rule": "follow_criterion_rules",
      "notes": "Original filename compliance is checked locally before anonymization. A missing/misnamed standalone file is scored once in task6."
    },
    {
      "deliverable_id": "surface_png",
      "description": "3D response-surface figure.",
      "required": true,
      "file_patterns": [
        "username_pr01_surface.png"
      ],
      "file_types": [
        "png"
      ],
      "applies_to_tasks": [
        "task5",
        "task6"
      ],
      "missing_rule": "follow_criterion_rules",
      "notes": "Original filename compliance is checked locally before anonymization. A missing/misnamed standalone file is scored once in task6."
    },
    {
      "deliverable_id": "contour_png",
      "description": "2D contour figure.",
      "required": true,
      "file_patterns": [
        "username_pr01_contour.png"
      ],
      "file_types": [
        "png"
      ],
      "applies_to_tasks": [
        "task5",
        "task6"
      ],
      "missing_rule": "follow_criterion_rules",
      "notes": "Original filename compliance is checked locally before anonymization. A missing/misnamed standalone file is scored once in task6."
    }
  ],
  "tasks": [
    {
      "task_id": "task1",
      "title": "Data Inspection and Preparation",
      "max_points": 25,
      "source_refs": [
        "project_project_01_intro_to_modeling_pdf"
      ],
      "criteria": [
        {
          "criterion_id": "t1_c1",
          "description": "Read ims_setup_raw.csv into df_raw and display the required raw-data inspection outputs.",
          "requirement_type": "technical_correctness",
          "max_points": 5,
          "source_refs": [
            "project_project_01_intro_to_modeling_pdf"
          ],
          "evidence": [
            {
              "evidence_type": "source_code",
              "description": "Code that loads the raw CSV into df_raw.",
              "required": true,
              "artifact_patterns": [
                "*.ipynb",
                "*.py"
              ],
              "location_hint": "Task I, step 1",
              "verification": "inspect"
            },
            {
              "evidence_type": "execution_result",
              "description": "Visible outputs for head(), shape, columns, describe(), and isna().sum().",
              "required": true,
              "artifact_patterns": [
                "*.ipynb",
                "*.pdf"
              ],
              "location_hint": "Task I, step 2",
              "verification": "manual_review"
            },
            {
              "evidence_type": "written_response",
              "description": "Markdown note describing initial data-quality problems observed.",
              "required": true,
              "artifact_patterns": [
                "*.ipynb",
                "*.pdf"
              ],
              "location_hint": "Task I, step 3",
              "verification": "manual_review"
            }
          ],
          "full_credit_condition": "df_raw is created from ims_setup_raw.csv and the notebook visibly shows head, shape, columns, describe, and missing-value counts, with a brief and data-supported observation of initial quality issues.",
          "deduction_rules": [
            {
              "rule_id": "t1_c1_miss_display",
              "condition": "One required inspection output is missing or not visible.",
              "deduction_points": 1.5,
              "feedback_template": "Include all required raw-data inspection outputs and keep them visible in the submitted notebook.",
              "basis": "technical"
            },
            {
              "rule_id": "t1_c1_wrong_name",